{
  "schema_version": "1.1.0",
  "chart_id": "chart-demo-001",
  "chart_type": "bar",
  "series": [
    {
      "name": "Synthetic samples",
      "values": [
        12,
        18
      ]
    }
  ],
  "image_ref": "charts/chart-demo-001.png",
  "caption": "Synthetic illustration only: the sample values are 12 and 18.",
  "numeric_checks": [
    {
      "value": 12,
      "csv_anchor": {
        "csv_ref": "fixtures/synthetic.csv",
        "row_number": 2,
        "column_name": "samples"
      },
      "verified": true
    },
    {
      "value": 18,
      "csv_anchor": {
        "csv_ref": "fixtures/synthetic.csv",
        "row_number": 3,
        "column_name": "samples"
      },
      "verified": true
    }
  ]
}
